{
  "schemaVersion": 1,
  "version": "1.5.0",
  "contexts": {
    "plectrum": {
      "root": "Plectrum checkout",
      "componentRoot": "libs/ui/src/lib",
      "stylesRoot": "libs/styles/src/06-components",
      "contracts": ".ai/contracts"
    },
    "consumer": {
      "root": "Application checkout",
      "componentRoot": "src/plectrum-candidates",
      "stylesRoot": "src/styles/06-components",
      "contracts": ".plectrum",
      "rule": "Never edit node_modules or assume libs/ui exists."
    }
  },
  "commands": {
    "scaffold": {
      "context": "plectrum",
      "command": "npm run pds:component -- --name=<name> --owner=<team>",
      "summary": "Create a Core or local-demo component with metadata, story and style partial.",
      "available": true
    },
    "generate": {
      "context": "plectrum",
      "command": "npm run contracts:generate",
      "summary": "Regenerate the metadata registry, exports, index, schemas, toolkit snapshot and editor adapters.",
      "available": true
    },
    "check": {
      "context": "plectrum",
      "command": "npm run contracts:check",
      "summary": "Validate schemas, registry, process commands, generated files and metadata readiness.",
      "available": true
    },
    "docs": {
      "context": "plectrum",
      "command": "npm run docs:check",
      "summary": "Check that docs pages render metadata and shared process data instead of restating them.",
      "available": true
    },
    "test": {
      "context": "plectrum",
      "command": "npm run test:pipelines",
      "summary": "Run the pipeline tests: schemas, scaffold, candidates and adoption.",
      "available": true
    },
    "pack": {
      "context": "plectrum",
      "command": "npm run pack:smoke",
      "summary": "Pack the libraries and build an isolated consumer application against the tarballs.",
      "available": true
    },
    "consumerInit": {
      "context": "consumer",
      "command": "npx --no-install plectrum init --team <id> --application <id> --repository <url>",
      "summary": "Create .plectrum/config.json, editor adapters, MCP entries and the CI workflow.",
      "available": true
    },
    "consumerBootstrap": {
      "context": "consumer",
      "command": "npx --no-install plectrum bootstrap",
      "summary": "Initialize or verify the Angular application, local ITCSS, Storybook and managed tooling. The application postinstall runs this automatically.",
      "available": true
    },
    "consumerUpdate": {
      "context": "consumer",
      "command": "npx --no-install plectrum update",
      "summary": "Regenerate managed adapters after a toolkit upgrade; report edited managed files as conflicts.",
      "available": true
    },
    "consumerCatalogue": {
      "context": "consumer",
      "command": "npx --no-install plectrum catalogue [--id <component-id>]",
      "summary": "List the installed offline catalogue, or print one component contract.",
      "available": true
    },
    "consumerDoctor": {
      "context": "consumer",
      "command": "npx --no-install plectrum doctor [--live]",
      "summary": "Check package and toolkit compatibility, managed files and configured MCP endpoints.",
      "available": true
    },
    "consumerValidate": {
      "context": "consumer",
      "command": "npx --no-install plectrum validate --schema <schema> --file <relative.json>",
      "summary": "Validate a local JSON file against an installed exchange schema.",
      "available": true,
      "values": {
        "schema": [
          "metadata",
          "proposal",
          "submission",
          "candidateReview",
          "candidatePromotion",
          "candidateFigmaReturn",
          "candidate",
          "adoption"
        ]
      }
    },
    "consumerTokens": {
      "context": "consumer",
      "command": "npx --no-install plectrum tokens check [--strict]",
      "summary": "Check --pds-* usage against the installed token inventory; --strict also rejects hex and px.",
      "available": true
    },
    "consumerCheck": {
      "context": "consumer",
      "command": "npx --no-install plectrum check --profile ci",
      "summary": "Run the CI profile: compatibility, strict tokens, source scan, managed adapters and candidates.",
      "available": true
    },
    "consumerScaffold": {
      "context": "consumer",
      "command": "npx --no-install plectrum scaffold --name <slug>",
      "summary": "Create a locally owned application component, story, unit test, metadata and ITCSS style without Core approval.",
      "available": true
    },
    "candidateExport": {
      "context": "consumer",
      "command": "npx --no-install plectrum candidate-export --name <slug> [--output <path>]",
      "summary": "Write a local candidate JSON draft without contacting the central repository.",
      "available": true,
      "scope": "local-draft"
    },
    "candidateSubmit": {
      "context": "consumer",
      "command": "npx --no-install plectrum candidate-submit --name <slug> --proposal <application>-<slug> --preview <url> --checks <url> [--dry-run]",
      "summary": "Open or revise the reviewed central intake pull request for the committed candidate.",
      "available": true
    },
    "candidateWithdraw": {
      "context": "consumer",
      "command": "npx --no-install plectrum candidate-withdraw --id <application>-<slug> --reason <text> [--dry-run]",
      "summary": "Open a central pull request that withdraws the submission; the ID stays reserved.",
      "available": true
    },
    "adoptionReport": {
      "context": "consumer",
      "command": "npx --no-install plectrum adoption-report [--output <path>]",
      "summary": "Write a local adoption draft of installed packages and detected component usage.",
      "available": true,
      "scope": "local-draft"
    },
    "adoptionSubmit": {
      "context": "consumer",
      "command": "npx --no-install plectrum adoption-submit [--dry-run]",
      "summary": "Open a reviewed central pull request with the adoption report.",
      "available": true,
      "scope": "reviewed-pull-request"
    },
    "tokensBuild": {
      "context": "plectrum",
      "command": "npm run tokens:build",
      "summary": "Generate token SCSS and Storybook token annotations from tokens.json.",
      "available": true
    },
    "tokensAudit": {
      "context": "plectrum",
      "command": "npm run tokens:audit",
      "summary": "Compare tokens.json, the preset and 01-settings; report drift.",
      "available": true
    },
    "tokensPropose": {
      "context": "plectrum",
      "command": "npm run tokens:propose",
      "summary": "Write the code-owned token proposal for Figma (proposed.dtcg.json).",
      "available": true
    }
  },
  "checkProfiles": {
    "component": [
      "generate",
      "check",
      "docs",
      "test"
    ],
    "release": [
      "generate",
      "check",
      "docs",
      "test",
      "pack"
    ],
    "tokens": [
      "tokensBuild",
      "tokensAudit",
      "tokensPropose"
    ],
    "consumerCi": {
      "commands": [
        "consumerCheck"
      ],
      "strictTokens": true,
      "requireSourceScan": true,
      "requireInstalledPackages": true,
      "requireManagedAdapters": true,
      "requireCandidateStoriesAndEvidence": true
    }
  },
  "steps": [
    {
      "id": "install",
      "journey": "onboarding",
      "owner": "team",
      "repository": "consumer",
      "prerequisites": [
        "package read access, or packed tarballs for an unreleased revision"
      ],
      "inputs": [
        "runtime packages",
        "toolkit package"
      ],
      "outputs": [
        "installed packages"
      ],
      "commands": []
    },
    {
      "id": "initialize",
      "journey": "onboarding",
      "owner": "team",
      "repository": "consumer",
      "prerequisites": [
        "installed toolkit",
        "application identity in package.json"
      ],
      "inputs": [
        "team, application and repository IDs"
      ],
      "outputs": [
        ".plectrum/config.json",
        "empty ITCSS layers and SCSS wiring",
        "local Storybook and unit-test setup",
        "editor and .ai adapters",
        "Git hook and CI workflow"
      ],
      "commands": [
        "consumerBootstrap",
        "consumerCatalogue",
        "consumerDoctor"
      ]
    },
    {
      "id": "build",
      "journey": "onboarding",
      "owner": "team",
      "repository": "consumer",
      "prerequisites": [
        "installed packages"
      ],
      "inputs": [
        "stylesheet include path",
        "providePlectrum()",
        "installed catalogue"
      ],
      "outputs": [
        "themed screens from PrimeNG, Core components and --pds-* tokens"
      ],
      "commands": []
    },
    {
      "id": "validate",
      "journey": "onboarding",
      "owner": "team",
      "repository": "consumer",
      "prerequisites": [
        "initialized toolkit"
      ],
      "inputs": [
        "application source and styles"
      ],
      "outputs": [
        "passing CI profile"
      ],
      "commands": [
        "consumerTokens",
        "consumerCheck"
      ]
    },
    {
      "id": "discover",
      "journey": "contribution",
      "owner": "team",
      "repository": "consumer",
      "prerequisites": [
        "installed packages and toolkit"
      ],
      "inputs": [
        "installed contract snapshot",
        "PrimeNG catalogue",
        "Figma design"
      ],
      "outputs": [
        "gap proposal"
      ],
      "commands": []
    },
    {
      "id": "approve",
      "journey": "contribution",
      "owner": "core",
      "repository": "plectrum",
      "prerequisites": [
        "gap proposal"
      ],
      "inputs": [
        "proposal"
      ],
      "outputs": [
        "recorded decision and owner"
      ],
      "commands": []
    },
    {
      "id": "implement",
      "journey": "contribution",
      "owner": "team",